{
  "schema_version": "1.1",
  "bundle_id": "beir-three-full-corpus-2026-07",
  "status": "complete",
  "dataset": "scifact",
  "split": "test",
  "source_profile_identity": "no_llm",
  "public_display_label": "Embedding + Reranking",
  "runner_profile": "bge_m3_rerank_baseline_v2",
  "counts": {
    "corpus_docs": 5183,
    "official_test_queries": 300,
    "qrels_rows": 339,
    "evaluated_queries": 300,
    "query_failures": 0
  },
  "metrics": {
    "recall_at_10": 0.7794444444444444,
    "recall_at_50": 0.9193333333333333,
    "ndcg_at_10": 0.6009192031295701,
    "ndcg_at_50": 0.6345248462308591
  },
  "latency_ms": {
    "p50": 7310.592896000344,
    "p95": 8766.053063300184,
    "count": 300,
    "definition": "one cold end-to-end HTTP query per official test-qrels query; runner linear-interpolation percentile",
    "comparison_scope": "within_dataset_paired_hardware_only"
  },
  "validity": {
    "scientific": {
      "status": "VALID",
      "reason": "The complete corpus and every official test query were evaluated with zero query failures."
    },
    "strict_feature_completeness": {
      "status": "PASS",
      "reason": "The retained baseline strict proof contains no required LLM-feature debt because those stages are disabled by profile contract."
    }
  },
  "hardware": {
    "provider": "AWS",
    "instance_type": "g5.2xlarge",
    "accelerator": "NVIDIA A10G",
    "embedding_execution_provider": "cuda",
    "reranker_execution_provider": "cuda",
    "pairing_scope": "scifact_only"
  },
  "source_locks": {
    "cortrix_core_sha": "4a6299ca86c7bec21ed7b8989a729a198fe5a42a",
    "measurement_runner_sha": "6defa0a50d696a7e4049413522fc0daca68f882e",
    "maintainer_orchestration_sha": "04a3eb676582c74e0752d6aecdc51e7c8f1b0c26",
    "status_contract_sha": "ba725c892ece3d0ce4e315c2d0155d82031f6d77"
  },
  "checksums": {
    "dataset_archive_sha256": "536e14446a0ba56ed1398ab1055f39fe852686ecad24a6306c80c490fa8e0165",
    "source_scorecard_sha256": "06822729fc110919ac6a65d514215cf9294dafc807e47a03b41a2240dc43ebab",
    "runner_profiles_source_sha256": "2dd762cbd22a57388c25ed16fee1c44eed6edf724aef6a55583f1eb1b6203aaf",
    "source_profile_record_sha256": "97830a9d84b365b27f2e5d2f1783f66014f4054892e613e05c9a817c64ca9dec",
    "redacted_server_config_sha256": "67d827b8f4cd8955e6fc8c9a8a5af7d136b3c627bf276abb39cb180ccad77d62"
  },
  "protocol": {
    "seed": 44044,
    "retrieval_depth": 250,
    "metric_cutoffs": [10, 50],
    "namespace_isolation": "isolated_scifact_embedding_reranking",
    "task_drain": "all submitted tasks terminal before measurement",
    "freeze": "no database writes during the measured query pass",
    "source_document_id_mapping": "metadata BEIR corpus ID plus read-only child-to-source alias mapping and document-level deduplication"
  },
  "provenance": {
    "run_id": "scifact-no-llm-20260714T122305Z",
    "measured_window": "2026-07-14",
    "scope_boundary": "retrieval_quality_only"
  }
}
