{
  "schema_version": "1.1",
  "bundle_id": "beir-three-full-corpus-2026-07",
  "status": "complete",
  "dataset": "fiqa",
  "split": "test",
  "source_profile_identity": "no_llm",
  "public_display_label": "Embedding + Reranking",
  "runner_profile": "bge_m3_rerank_baseline_v2",
  "counts": {
    "corpus_docs": 57638,
    "official_test_queries": 648,
    "qrels_rows": 1706,
    "evaluated_queries": 648,
    "query_failures": 0
  },
  "metrics": {
    "recall_at_10": 0.3635011336400227,
    "recall_at_50": 0.6342567454835977,
    "ndcg_at_10": 0.2525741428783595,
    "ndcg_at_50": 0.3323594258364845
  },
  "latency_ms": {
    "p50": 26520.88781350085,
    "p95": 33302.56768604977,
    "count": 648,
    "definition": "one cold end-to-end HTTP query per official test-qrels query; runner linear-interpolation percentile",
    "comparison_scope": "within_dataset_paired_hardware_only"
  },
  "validity": {
    "scientific": {
      "status": "VALID",
      "reason": "The complete corpus and every official test query were evaluated with zero query failures."
    },
    "strict_feature_completeness": {
      "status": "NOT_EVALUATED",
      "reason": "This retained result predates the terminal-status v1.0 contract, so run-specific feature evidence is not promoted to a formal strict result."
    }
  },
  "hardware": {
    "provider": "AWS",
    "instance_type": "c7i.8xlarge",
    "accelerator": "none",
    "embedding_execution_provider": "cpu",
    "reranker_execution_provider": "cpu",
    "pairing_scope": "fiqa_only"
  },
  "source_locks": {
    "cortrix_core_sha": "4a6299ca86c7bec21ed7b8989a729a198fe5a42a",
    "measurement_runner_sha": "6defa0a50d696a7e4049413522fc0daca68f882e",
    "maintainer_orchestration_sha": "3e94f768fed8896ef8aa087b8a1f6281241aed5e",
    "status_contract_sha": "ba725c892ece3d0ce4e315c2d0155d82031f6d77"
  },
  "checksums": {
    "dataset_archive_sha256": "32c7df99ed21252fdfb2cf3f5673502a8d245ee0c44c4a133570d92ce2b3ad02",
    "source_scorecard_sha256": "21312ab1b2cb4be15990897e8e036557a8e72f8c99f934ab07252f32647da83a",
    "runner_profiles_source_sha256": "2dd762cbd22a57388c25ed16fee1c44eed6edf724aef6a55583f1eb1b6203aaf",
    "source_profile_record_sha256": "97830a9d84b365b27f2e5d2f1783f66014f4054892e613e05c9a817c64ca9dec",
    "redacted_server_config_sha256": "4f69a8ac049ca104b57b47cc131db68bbdb462441a1d73b94156a2a9bdc17199"
  },
  "protocol": {
    "seed": 44044,
    "retrieval_depth": 250,
    "metric_cutoffs": [10, 50],
    "namespace_isolation": "isolated_fiqa_embedding_reranking",
    "task_drain": "all submitted tasks terminal before measurement",
    "freeze": "no database writes during the measured query pass",
    "source_document_id_mapping": "metadata BEIR corpus ID plus read-only child-to-source alias mapping and document-level deduplication"
  },
  "provenance": {
    "run_id": "fiqa-no-llm-20260714T112205Z",
    "measured_window": "2026-07-14",
    "scope_boundary": "retrieval_quality_only"
  }
}
