{
  "schema_version": "1.1",
  "bundle_id": "beir-three-full-corpus-2026-07",
  "status": "complete",
  "dataset": "fiqa",
  "split": "test",
  "source_profile_identity": "full_llm",
  "public_display_label": "Full Stack",
  "runner_profile": "bge_m3_rf_pool_listwise",
  "counts": {
    "corpus_docs": 57638,
    "official_test_queries": 648,
    "qrels_rows": 1706,
    "evaluated_queries": 648,
    "query_failures": 0
  },
  "metrics": {
    "recall_at_10": 0.5204965730428691,
    "recall_at_50": 0.6640487127755649,
    "ndcg_at_10": 0.46629212707101036,
    "ndcg_at_50": 0.5061861036723014
  },
  "latency_ms": {
    "p50": 106172.47638299887,
    "p95": 135121.1999856998,
    "count": 648,
    "definition": "one cold end-to-end HTTP query per official test-qrels query; runner linear-interpolation percentile",
    "comparison_scope": "within_dataset_paired_hardware_only"
  },
  "validity": {
    "scientific": {
      "status": "VALID",
      "reason": "The complete corpus and every official test query were evaluated with zero query failures."
    },
    "strict_feature_completeness": {
      "status": "NOT_EVALUATED",
      "reason": "This retained result predates the terminal-status v1.0 contract, so run-specific feature evidence is not promoted to a formal strict result."
    }
  },
  "hardware": {
    "provider": "AWS",
    "instance_type": "c7i.8xlarge",
    "accelerator": "none",
    "embedding_execution_provider": "cpu",
    "reranker_execution_provider": "cpu",
    "pairing_scope": "fiqa_only"
  },
  "source_locks": {
    "cortrix_core_sha": "4a6299ca86c7bec21ed7b8989a729a198fe5a42a",
    "measurement_runner_sha": "6defa0a50d696a7e4049413522fc0daca68f882e",
    "maintainer_orchestration_sha": "3e94f768fed8896ef8aa087b8a1f6281241aed5e",
    "status_contract_sha": "ba725c892ece3d0ce4e315c2d0155d82031f6d77"
  },
  "checksums": {
    "dataset_archive_sha256": "32c7df99ed21252fdfb2cf3f5673502a8d245ee0c44c4a133570d92ce2b3ad02",
    "source_scorecard_sha256": "c9c92ce8a9685468c8c3cf94e811d06d5fd730567782c8b6375ed8d88867e476",
    "runner_profiles_source_sha256": "2dd762cbd22a57388c25ed16fee1c44eed6edf724aef6a55583f1eb1b6203aaf",
    "source_profile_record_sha256": "0e2765024eeabc5d1d022a7e34626274d5e53e4ee419a32e767ce11f60aa971f",
    "redacted_server_config_sha256": "2f5ee5755a6ca3b3c604e365eb7448d07b58ed8f3261aa9a21c67840dd98b310"
  },
  "protocol": {
    "seed": 44044,
    "retrieval_depth": 250,
    "metric_cutoffs": [10, 50],
    "namespace_isolation": "isolated_fiqa_full_stack",
    "task_drain": "submitted tasks terminal and document summaries drained before measurement",
    "freeze": "no database writes during the measured query pass",
    "source_document_id_mapping": "metadata BEIR corpus ID plus read-only child-to-source alias mapping and document-level deduplication"
  },
  "provenance": {
    "run_id": "fiqa-full-llm-20260714T202340Z",
    "measured_window": "2026-07-14/2026-07-15",
    "scope_boundary": "retrieval_quality_only"
  }
}
